apart_id,author_id,date,review
16608551,112432129,2017-02-26T06:35:43Z,"Спасибо большое Елене. Квартира оказалась с хорошим ремонтом, очень чистой и удачно расположенной (рядом несколько супермаркетов, линия скоростного трамвая, остановки общественного транспорта, достаточное количество ресторанов и набережная реки Волги). Елена отзывчивый человек и пошла на встречу с поздним заселением, так же подсказала с выбором такси."
16608551,109802929,2017-02-18T06:31:03Z,Замечательное жилье с удобным месторасположением! Полностью соответствует представленным фотографиям. Приятный и вежливый хозяин! Огромное спасибо! 
16608551,2572484,2017-01-21T19:31:35Z,The host canceled this reservation the day before arrival. This is an automated posting.
16608551,49461405,2017-01-08T06:46:39Z,Уютная квартира в центре города. Мне очень понравилось)
10601695,31207411,2017-01-15T08:47:16Z,"Отличная, чистая, уютная квартира, в точности, как на фото. Располагается в центре города. Достопримечательности, центральная набережная, бары, клубы, рестораны - все в шаговой доступности.
В случае каких-то вопросов, Павел все расскажет, подскажет куда лучше сходить, что посмотреть.
В общем спасибо, за хороший прием!"
10601695,46921141,2016-08-01T08:31:57Z,"Nice place, quiet, clean and bright, also very convenient to other places. There are supermarket, bus stop surround by. Our host is very kind and helpful. It's an excellent experience in Volgograd ! "
10601695,6406994,2016-05-25T11:05:20Z,"Отличные апартаменты. Ремонт супер, расположение очень неплохое. Рекомендую."
10601695,30638246,2016-05-04T00:15:48Z,"Квартира отличная, чистая, уютная, полностью соответствует фотографиям, есть все необходимое. Очень удобное месторасположение - в самом центре города. Павел - очень гостеприимный хозяин, с заселением и отъездом никаких проблем не возникло. Спасибо Вам большое! Рекомендуем!"
13368193,74582132,2016-09-16T05:22:36Z,"Останавливались на неделю в сентября. Нам все понравилось. Квартира соответствует описанию и фотографиям. Ольга всегда доступна для обратной связи. Квартира расположена в центре, до набережной рукой подать, с балкона даже можно увидеть Волгу. Но тот кто любит тишину, тот должен будет подумать о другом варианте, так как окна выходят на оживленную улицу. Шикарный вид из окна - на капители ДК Профсоюзов. Спасибо за комфортное проживание."
13368193,70445320,2016-09-05T11:13:46Z,"Ездили на несколько дней посмотреть красоты и достопримечательности Города Героя Волгограда. После долгого и тщательного просмотра доступных вариантов квартир остановились на этом - и не ошиблись.Очень удобное расположение! Буквально в шаговой доступности все достопримечательности и магазины. Очень уютная квартира. Несомненно, мы сделали правильный выбор и когда в следующий раз будет планироваться поездку в этот город - мы уже знаем где остановиться:)"
13368193,64042137,2016-08-23T07:40:56Z,"Дом расположен в удобном районе города. Самый что ни на есть центр. Хозяйка - просто само радушие! Из-за пробок мы задержались, но хозяйка нас ждала, все показала и разместила. Квартира приятная, удобная и вполне комфортная для проживания. Вечером очень удобно выйти погулять, в пешей доступности магазины и кафе. Очень впечатлил город! В квартире жить было удобно. Спасибо!"
13739796,69394165,2016-08-02T10:37:26Z,"Надежда не смогла предоставить нам указанную в объявлении квартиру, но быстро нашла аналог. За это мы очень благодарны - размещение второй квартиры было даже лучше и ближе к центру, чем у первой. К сожалению, Надежду мы так и не увидели - нас встречал посредник - но хозяйка держала связь по телефону и была очень отзывчива."
13739796,19420353,2016-07-30T05:29:51Z,"Rien a dire bonne endroit
"
13739796,41789155,2016-07-25T03:02:35Z,"Квартира чистая, соответствует описанию. Вся необходимая бытовая техника в рабочем состоянии. Очень удобно. Заселялись поздним вечером без проблем. Небольшое пожелание -добавить ложки,вилки на пару человек."
13739796,49943813,2016-07-19T06:04:19Z,"очень комфортное жилье с кондиционером, что важно."
12857469,12922858,2016-08-08T06:27:09Z,"Квартира большая, расположена не далеко от главной достопримечательности города. Район тихий и спокойный. Окна во двор. Есть все необходимое. Хорошее соотношение цена\качество. Из минусов: раковина в ванной шатается, можно пережить. В целом остались довольны."
15023164,61358275,2016-11-14T08:07:29Z,"Жилье соответствует описанию, самый центр, вид на Волгу - в общем все отлично!"
15023164,26913908,2016-09-23T07:40:06Z,"Все было в меру удобно. Немного переживали, что не смогли до вас перед выездом дозвонится. Ключи в квартире оставили"
4522311,10186537,2015-09-02T12:42:05Z,"Провели три замечательных дня в Волгограде. Жилье дополнило впечатления: удобное месторасположение в центральном районе, недалеко от Волги и главной набережной, прекрасная транспортная доступность - поблизости остановки маршруток, метро, удобная инфраструктура - хорошие кафе на аллее, магазины и фаст фуд. Неподалеку рыночек, где можно купить фрукты и овощи.
Сами апартаменты стильные, чистые, уютные. Всё продумано для комфорта. Хозяева доброжелательные :) "
10328258,25656339,2016-08-09T03:06:56Z,Квартира полностью соответствует описанию. В ней есть все что нужно. Мы были в квартире проездом из пункта А в пункт В и Андрей отлично организовал доступ к жилью. Спасибо!
12553367,71775789,2016-08-14T06:07:46Z,"Прекрасная комфортная квартира в центре, развитая инфраструктура, отличные хозяева, остались очень довольны, рекомендуем. "
12553367,9810810,2016-04-28T13:49:23Z,The host canceled this reservation 10 days before arrival. This is an automated posting.
4103228,94909751,2016-09-18T06:34:14Z,"Хотела бы рассказать о нагем путешествии в Волгоград. Мы бронировали данную квартиру, но, к сожалению, данная квартира была занята и нам предложили квартиру еще лучше. Квартира располагалась на набережной, в самом центре. Цена не была изменена. Спасибо Евгению и Наталье"
4103228,22751982,2014-11-05T12:05:55Z,"Небольшая квартира в центре Волгограда, чистая. Очень удобное расположение. Для одного-двух гостей — в самый раз. Из минусов — очень темный подъезд, страшновато входить вечером.
Спасибо Наталии и Евгению за прием!"
3409497,35364151,2016-05-05T01:59:53Z,"Квартира соответствует фотографиям, но заметно, что сдается очень активно и достаточно давно, по этому не все так идеально. Достаточно чисто, уютно. Для того, что бы переночевать одну-две ночи - вариант замечательный. Чистый тихий двор, машину оставляли спокойно, до остановки общественного транспорта - пара минут пешком. магазины рядом есть."
4108639,18858607,2016-08-20T04:22:21Z,"Просторные апартаменты у самой набережной. Отличное расположение, если вы хотите посмотреть город. Панорама вообще через дорогу) Недалеко станция скоростного трамвая. Да и вся центральная часть в пешеходной доступности. Квартира просторная, чистая. Если рано утром выйти на балкон, то можно увидеть потрясающий рассвет)"
4108639,9738996,2015-04-06T15:09:23Z,"Только сегодня вернулся из Волгограда. Впечатлений море. И все положительные! !!! Квартира великолепная. Расположение -самый центр. Напротив  великолепный вид на ""Панораму"" , дом  Павлова и набережную. Рекомендую всем! Не пожалеете!"
12878157,79016163,2016-08-30T06:46:08Z,"Фотографии в объявлении не соответствуют действительности. Ремонт и мебель старые, полотенца и постельное чистые, но старые и не комплектами. Далеко от мамаева кургана. Рядом есть кафе ""Хмели Сунели"" - очень хорошое место, с обалденной кухней, советую сходить."
12329574,28389434,2017-02-14T05:17:32Z,уютно
12329574,26143424,2016-08-10T06:16:30Z,"Большое спасибо Андрею за помощь в выборе жилья! Были в Волгограде проездом и искали ночлег. Хозяин быстро ответил на все вопросы, все рассказал и помог в выборе квартиры. Встретил ночью, проводил ранним утром. Отлично организовал наш отдых. Мы без пробоем отдохнули, привели себя в порядок и позавтракали"
15023078,43364131,2016-11-17T08:52:18Z,"Квартиру предоставили другую. Хозяин пошел на встречу и заселил раньше.
в общем впечатления положительные."
6808443,21988980,2015-07-03T15:26:41Z,"По пути от моря к дому была забронирована квартира, за пару часов до приезда оказалось, что в квартире уже 2 недели нет горячей воды. Сразу же был предложен вариант за туже сумму, состоящий из 2-х комнат. В самом центре, около панорамы. 
С нашим приездом вышла накладка, прибыли на 2 часа позже от запланированного времени, хозяева радушно встретили. Квартира понравилась, чистая, свежий ремонт. Кровать 2-х спальная, диван, телевизор, wi-fi, на кухне посуда, микроволновка.  Все соответствовало фото."
4114900,50597917,2015-12-21T15:19:34Z,"Однозначно могу посоветовать семье с детьми (как мы). Тихая часть центра города - до всех достопримечательностей 15 минут пешком, прямо на первой линии возле Волги, первый этаж (удобно с коляской), за домом сразу парк, где можно погулять с детьми.
Сама квартира без изыска - простая, но чистая и всё есть для проживания. Кабельное ТВ и Интернет - всё есть) В центре города за эти деньги прекрасный вариант. Заселили быстро и без проблем.
Сам город великолепен, чистый, освещается каждый переулок, но самое главное - это его дух, дух великой Победы. Мы первый раз в Волгограде, но обязательно приедем вновь!"
6808498,75340529,2016-10-10T06:33:14Z,"Хозяин нам ничего не показал, не рассказал. Дали ключи и сказали и пожелали хорошего отдыха. Квартира грязная, про посуду вообще молчу. За кроватью валяются презервативы, в гостиной за диваном тоже. Стиральная машина в ужасном состоянии. Окна, подоконники грязные. Остались там, потому что не было выбора. Квартира просто в ужасном состоянии. Приложила бы фото, да не знаю, как это сделать. Не советую "
6808498,17642937,2016-01-07T11:42:52Z,"Жильё предлагается для сдачи не только через airbnb, по телефону с нами контактировала не девушка, а мужчина. Он нам предложил посмотреть другую квартиру, так как выбранную нами хотели арендовать другие люди. Мы отказались и в итоге заселились в данную квартиру. Да и ещё, за два дня до въезда нас просили подтвердить прибытие, и это при том, что на airbnb вы фактически сразу  оплачиваете проживание. Также не зря мы выбираем то жильё, которое подходит именно нам и предложение выбрать другой вариант считаю неприемлемым. Описание самой квартиры: расположение отличное, рядом траттория Римини с неплохой едой, круглосуточный продуктовый магазин Гурман. До музея-панорамы Сталинградской битвы - 10 минут пешком, до Родины Матери - 20 минут общественным транспортом. До центра города, набережной, 15-20 минут пешком. Квартира не была тщательно убрана перед нашим приездом, вследствие этого были неприятные сюрпризы, сиденье и крышка унитаза не зафиксированы, кровать поскрипывает. Есть посуда, тарелки, бокалы, стаканы, кружки, кастрюля. Какого-либо специфического запаха в квартире нет - несомненно плюс. Большая ванна, приличная площадь квартиры и вид из окна на академию гос. службы. Тепло при -15 ночью."
5001106,51638315,2015-12-21T17:38:54Z,"В целом предоставленная квартира была удовлетворительного состояния, но опыт мог бы быть более приятным. Квартиру я забронировал и оплатил за сутки до заселения и получил подтверждение от ""Натальи"", по прилету в Волгоград я позвонил по указанному телефону, где мне некий мужчина сказал что квартиру уже сдали, потому что я что то там не подтвердил. Хотя обещали предоставить замену, но когда едешь с детьми такие ситуации крайне неприятны. По изначальному описанию была указана идеальная чистотота и мне обещали дать квартиру не хуже, конечно до идеальной чистоты очень далеко, но квартира на замену в целом устраивала и было уже поздно, поэтому мы остались. При заселении сразу не заработал газовый нагреватель, но его в течении часа завели, также сразу не заработал wifi. Все это безусловно мелочи, но из них складывается общее впечатление. Кваритира находится в самом центре и когда-то очень давно был сделан современный ремонт, на кухне и в ванной был приятный теплый пол. За Натальей конечно скрывается агенство по посуточной сдаче квартир. В этом конечно ничего плохого нет, однако их неорганизованность в плане учета занятости квартир есть непрятный осадок. Если бы работа велась более открыто вероятно было бы лучше. "
6808128,9482817,2015-07-24T15:13:35Z,"Квартира чистая и уютная. Расположена в удобном районе. Заехали в нужное нам время без ожидания. Рядом с домом есть продуктовый магазин и кулинария. Немного в стороне также много заведений с быстрой едой.
Двор тихий и уютный. Есть тень - летом очень важно. Есть место для машины. 
До городского пляжа (так называемый о. Крит) ехать 15 минут."
10601695,31207411,2017-01-15T08:47:16Z,"Отличная, чистая, уютная квартира, в точности, как на фото. Располагается в центре города. Достопримечательности, центральная набережная, бары, клубы, рестораны - все в шаговой доступности.
В случае каких-то вопросов, Павел все расскажет, подскажет куда лучше сходить, что посмотреть.
В общем спасибо, за хороший прием!"
10601695,46921141,2016-08-01T08:31:57Z,"Nice place, quiet, clean and bright, also very convenient to other places. There are supermarket, bus stop surround by. Our host is very kind and helpful. It's an excellent experience in Volgograd ! "
10601695,6406994,2016-05-25T11:05:20Z,"Отличные апартаменты. Ремонт супер, расположение очень неплохое. Рекомендую."
10601695,30638246,2016-05-04T00:15:48Z,"Квартира отличная, чистая, уютная, полностью соответствует фотографиям, есть все необходимое. Очень удобное месторасположение - в самом центре города. Павел - очень гостеприимный хозяин, с заселением и отъездом никаких проблем не возникло. Спасибо Вам большое! Рекомендуем!"
12878157,79016163,2016-08-30T06:46:08Z,"Фотографии в объявлении не соответствуют действительности. Ремонт и мебель старые, полотенца и постельное чистые, но старые и не комплектами. Далеко от мамаева кургана. Рядом есть кафе ""Хмели Сунели"" - очень хорошое место, с обалденной кухней, советую сходить."
4522311,10186537,2015-09-02T12:42:05Z,"Провели три замечательных дня в Волгограде. Жилье дополнило впечатления: удобное месторасположение в центральном районе, недалеко от Волги и главной набережной, прекрасная транспортная доступность - поблизости остановки маршруток, метро, удобная инфраструктура - хорошие кафе на аллее, магазины и фаст фуд. Неподалеку рыночек, где можно купить фрукты и овощи.
Сами апартаменты стильные, чистые, уютные. Всё продумано для комфорта. Хозяева доброжелательные :) "
3409497,35364151,2016-05-05T01:59:53Z,"Квартира соответствует фотографиям, но заметно, что сдается очень активно и достаточно давно, по этому не все так идеально. Достаточно чисто, уютно. Для того, что бы переночевать одну-две ночи - вариант замечательный. Чистый тихий двор, машину оставляли спокойно, до остановки общественного транспорта - пара минут пешком. магазины рядом есть."
15023078,43364131,2016-11-17T08:52:18Z,"Квартиру предоставили другую. Хозяин пошел на встречу и заселил раньше.
в общем впечатления положительные."
4103228,94909751,2016-09-18T06:34:14Z,"Хотела бы рассказать о нагем путешествии в Волгоград. Мы бронировали данную квартиру, но, к сожалению, данная квартира была занята и нам предложили квартиру еще лучше. Квартира располагалась на набережной, в самом центре. Цена не была изменена. Спасибо Евгению и Наталье"
