apart_id,author_id,date,review
6235195,9990565,2017-02-13T07:55:29Z,"Tatjana ist eine sehr freundliche Frau, die ich selber getroffen habe. Die Wohnung entspricht der Beschreibung und ist sehr sauber. Es gibt genügend Platz und bietet alles, was man braucht, auch zum Kochen und Arbeiten. Man kann sich in der Wohnung sicher fühlen, obwohl sie sich im Erdgeschoss befindet. Die Wohnung ist genügend beheizt, alles funktioniert einwandfrei.
Ich würde jederzeit wieder dort wohnen wollen."
6235195,28680874,2016-10-06T06:43:22Z,"Хороший вариант для пребывания в Волгограде, квартира расположена в самом центре, закрытая парковка. "
6235195,50506731,2016-09-17T05:35:43Z,"Тихое место, закрытая парковка. Всё понравилось, небольшие нарекания вызвали только подушки."
6235195,79778408,2016-09-11T05:38:48Z,"Квартира полностью соответствует описанию. Тихий закрытый дворик с парковкой. Татьяна всегда на связи с полным пониманием клиента- молодец, спасибо! Рекомендую небольшим группам путешественников."
6235195,41936192,2016-09-08T07:37:33Z,"Мы остались очень довольны пребыванием у Татьяны! Квартира расположена в центре города, чистенько , уютно.  Несмотря на то, что Татьяна была на тот момент не в городе, она постоянно звонила и спрашивала всё ли у нас хорошо и есть ли у нас вопросы."
6235195,31354882,2016-09-05T01:19:52Z,"Уютная небольшая квартира находится на первом этаже в самом центре города, пешком можно дойти до всех достопримечательностей Волгограда.  Двор тихий, закрытый, есть парковка. Останавливались с друзьями на одну ночь, Татьяна нас встретила и заселила в 9 утра. Квартира полностью соответствует фотографиям. У нас остались только положительные впечатления от общения с Татьяной."
6235195,21846187,2016-08-13T06:13:44Z,Очень уютная и чистая квартира в самом центре города. Порадовало наличие кондиционера. Закрытый двор с парковкой. Татьяна очень быстро отреагировала на запрос. Наилучшие рекомендации.
6235195,14807637,2016-08-01T01:07:38Z,"Все было замечательно. Очень уютное место, весь транспорт рядом."
6235195,13327540,2016-07-05T05:09:41Z,"Останавливались с семьей, очень понравилось. Уютно и дружелюбно."
6235195,15902000,2016-06-15T05:54:06Z,"Clean apartment, great location, very attentive host."
6235195,19026755,2016-05-04T20:59:07Z,"Останавливались с друзьями в квартире у Татьяны на одну ночь. Квартира полностью соответствует описанию. Хозяйка нас встретила и проводила вовремя. Квартира расположена удобно - в центре города,– хороший вариант, чтобы остановиться вчетвером. Спасибо!"
15105657,77978866,2016-09-28T05:16:59Z,"Останавливались на одну ночь, все в точь соответствует описанному. Уютно, тепло, есть вай фай с хорошей скоростью. Все понравилось, спасибо Валерию."
13823568,94709333,2016-09-13T03:56:04Z,The host canceled this reservation 52 days before arrival. This is an automated posting.
4826265,15769138,2016-10-30T07:37:45Z,"Начать, пожалуй, стоит с того, что лично Евгений не появился. 
Во-вторых, квартиру, которую я бронировал, так я и не увидел. Евгений сообщил, что квартира на ул. Советской, 49а сейчас недоступна, в ней нет никакой воды, ни горячей, ни холодной. Это я от него узнал только когда уже ехал из аэропорта Волгограда на адрес. 
Примечательно, что я звонил Евгению за несколько часов до прилета в Волгоград, во время пересадки в Москве. На тот момент, с квартирой было всё отлично. 
В итоге, нужно было ехать на другой адрес, где меня встретил совершенно другой человек; некая женщина, показала квартиру, которая по словам Евгения даже лучше той, что я бронировал. 
Когда я пришел с этой женщиной на адрес, там было нечто совершенно неприемлемое. Мне показали прокуренную однушку, где было грязно и пыльно, матрац продавленный, постельное бельё затертое до дыр, дверной ручки в ванную комнату не было вовсе. 
Когда я отказался от этого, так сказать варианта, женщина отвела меня на третий адрес, ул. Чуйкова 45, где меня должен был встретить еще один риэлтор Дмитрий. Сама она спешно исчезла и оставила меня дожидаться этого Дмитрия. 
Третью квартиру мне показывал Дмитрий, она оказалась более менее приемлемой. Запаха табака в помещении не было, в наличие было в общем всё, что было необходимо для жизни в квартире: посуда, сушка для белья, стиральная машина, утюг, микроволновая печь, сплит-система, мебель в удовлетворительном состоянии. 
В этой квартире все же было не убрано, пыльно, вместо простыни был пододеяльник, посуда вся грязная, раковина умывальника с трещиной. 

В общем, дорогие друзья, хозяева этих квартир - Вы что ли для скота работаете, не для людей? Вы выставляете свои квартиры на международном сайте бронирования жилья и относитесь к вашим клиентам, приезжим людям, как к ничтожествам! Вы недостойны быть допущенными вообще к чему-либо из сферы услуг, потому что Вы не способны их предоставлять в том виде, во сколько их оцениваете. Вам бы на рынке мясом торговать. И то, продавцы мяса на рынках гораздо приветливее и профессиональнее в отношении с людьми, покупателями. 
Служба поддержки Airbnb всенепременно будет проинформирована об этом, это просто немыслимо, чтобы  люди приезжали в гости в ваш город и платили вам деньги за то унижение, которому, Вы их подвергаете. "
4826265,26950237,2016-06-22T04:36:34Z,"Шикарная квартира в центре города. В шаговой доступности Сталинградская панорама, музей и дом Павлова. В квартире чистота на высшем уровне. Все вопросы решаются молниеносно. Отдельное спасибо за скорость заселения хозяевам и предоставленный финансовый фокус он Airbnb. У нас произошла накладка с заселением и мы просто оказались на улице с тремя детьми и беременной женой. Спасибо ещё раз хозяевам этой замечательной квартиры и Артуру ( сотруднику Airbnb). "
4826265,9679235,2015-02-16T16:15:03Z,"квартира хорошая , но вот вот была сломана печь , а нам была очень необходима . а так квартира отличная ."
4826265,18717507,2015-01-08T12:39:10Z,Before arrivial I was told to go into another apartment as I had booked and there was no service to take me from the main station as it was offered in the profile description. At the arrival a lot of unpleasant points could be found in the apartment. In the stove was still a half eaten lasagne and the refrigerator had splodges from former food. Some furniture was broken and there was dust everywhere. (I was told that there was a professional cleaning just two hours before) The apartment itself was large and at a good place at the city center close to the main squares. But the condition of the apartment is very critical for the money that I had to spend. So I recommend to explicit agree on the condition standarts of the apartment in advance!
4098554,40352311,2015-08-08T00:10:19Z,"Не рекомендую.

Судя по всему, квартиру сдает агентство. Качество квартиры и отношение к клиенту - соответствующие:

Агент не может толком объяснить как подъехать к дому (дом глубоко во дворах и на навигатор полагаться не стоит)
В подъезде темно как в пещере - не горит ни одна лампочка.
В квартире - старая, рассохшаяся, разваливающаяся мебель.
Белье такое же старое и застиранное. 
В ванной - тараканы и ёршик в говне.



"
4098554,21903384,2015-04-27T14:42:53Z,"Достоинством этих апартаментов является их месторасположение. В центре Волгограда, в пешей доступности от Площади Ленина, дома Павлова, музея ""Сталинградская битва"" и мемориала ""Родина-Мать зовет"" (минут 20-30). Апартаменты на первом этаже пятиэтажки. 
Реальное состояние апартаментов отличается от фото: старая мебель (разваливающиеся кресла). Можно порекомендовать для улучшения:
1) укомплектовать ванную комнату феном, шампунем, гелем, большими полотенцами;
2) заменить ветхое постельное белье новым;
3) отремонтировать неисправности (выбитое стекло в межкомнатной двери, кондиционер и т.д.). Без кондиционера на обогрев ночью было холодно;
4) поддерживать чистоту.
Встретили в апартаментах в назначенное время, порекомендовали такси и предоставили код на скидку, за что большое спасибо."
4099036,25337015,2015-01-12T13:39:57Z,"What an amazing apartment! If your visiting Volgograd, this is the perfect place to stay. Fantastic host that communicated well, no problems what so ever. Minute walk to train station, I highly recommend staying here."
4099036,25424139,2015-01-04T15:56:39Z,"Хозяева довольно не пунктуальные люди, договорись о определенном времени прибытии, квартира к нему не была готова, пришлось ждать 1,5 часа. Фото квартиры не соответствуют текущему состоянию, душ сломан, разбиты стекла в стеклопакетах, сломан ключ от железной двери, приходилось пользоваться только деревянной, а она довольно хлипкая, освещение на потолке местами было выдрано, свисали плафоны на проводах. За текущее состояние квартиры цена сильно завышена. "
1113856,9353178,2017-03-20T06:32:34Z,Все отлично. Идеальный вариант чтобы остановиться на пару дней. Цена=качество
1113856,84496059,2017-02-26T05:46:04Z,"Все понравилось ,все соответствует фотографиям."
1113856,3137451,2017-02-10T06:56:54Z,"Чисто, уютно. Хороший район."
1113856,103626637,2017-01-21T06:08:07Z,"Отличная квартира, полностью соответствующая описанию. Тихий район. Парковались во дворе без проблем. Есть всё для комфортного проживания."
1113856,13878299,2016-05-17T01:58:43Z,"Останавливались в квартире Артема на Краснознаменской. Квартира выше всяких похвал! Полностью соответствует описанию и фотографиям. В квартире есть абсолютно все, что может потребоваться, в том числе фильтр питьевой воды! Полы в ванной и в комнате подогреваются, что очень приятно.
Артем - очень позитивный внимательный молодой человек, всегда готовый помочь! У нас остались прекрасные впечатления!"
1113856,66933969,2016-05-10T02:08:21Z,"Все было отлично - сами апартаменты, место.
Народ, нужно брать."
1113856,25056577,2016-05-09T03:55:45Z,"Очень уютная квартира в самом центре города. Несмотря на расположение дом находится в тихом месте с уютным двориком, засаженным кустами сирени. Рядом кафе и магазины. Недалеко остановка трамвая, маршруток, недалеко идти до речного порта.
Сама квартира чистая. Мебель, сантехника, бытовые приборы- все новое. Имеется все необходимое, в том числе фен, утюг и большое зеркало. 
Единственное, что удивило - отсутствие окна и двери в спальне. Однако, мы останавливались у Артема на несколько дней, и нам это не доставило больших неудобств. 
Квартира комфортная и подходит для туристов.  "
1113856,58293252,2016-05-04T03:51:49Z,"Спасибо за гостеприимство, все было замечательно. Квартира в самом центре, в ней есть все необходимое для комфортного пребывания."
1113856,38216040,2016-04-11T01:51:15Z,"Всё было прекрасно,  всем абсолютно доволен! Спасибо за прекрасно проведенное время в Волгограде. "
1113856,32253147,2016-01-16T12:40:45Z,"Спасибо за чудесную квартирку!
Она оказалась немного меньше, чем представлялось, но не менее уютной. 
Все чисто, аккуратно, тихо. Наличие полотенец и халатов, кофе, чая, вкусняшек  делают пребывание очень комфортным.
Также порадовало наличие обогревателя (и доп. одеяла).
Это решило проблему того, что мне было прохладно в квартире.
Отдельный жирный плюс за расположение. Оно фантастическое."
1113856,23211359,2015-12-20T13:42:51Z,"Прекрасная квартира, полностью соответствует описанию. Всем рекомендую!"
1113856,49461405,2015-11-22T22:45:54Z,Хата просто супер!
1113856,29822613,2015-11-11T12:52:06Z,"Artem patient, good communication and friendly. Beautiful rooms, close to downtown. "
1113856,25364547,2015-11-02T17:09:46Z,"Расположение квартиры в центре центра Волгограда. Уютно, светло, есть все необходимое для комфортного отдыха от полотенец и банных халатов до посуды и всяких приятных мелочей. Порадовал легкий завтрак, кофе и чай. До набережной 15 минут пешком. Очень советую. "
1113856,7927878,2015-09-10T14:28:45Z,Отличная квартира и недорого для расположения в самом центре Волгограда. Буду рада остановиться здесь еще как-нибудь!
1113856,32479183,2015-08-28T14:41:27Z,"Отличная квартира! Удобное расположение в городе, полностью соответствует описанию и фотографиям, вежливый и внимательный хозяин. Жить было - одно удовольствие. Всем рекомендуем!"
1113856,3663241,2015-07-28T13:10:25Z,"Артём очень профессионален в своём деле, нам было очень приятно с ним взаимодействовать. Квартира действительно шикарная, в ней есть всё, что может понадобиться для комфортного проживания. Кроме того она расположена очень рядом с вокзалом (не более 20 минут пешком) и в самом центре города.
Рекомендую всем, кто приезжает в Волгоград."
1113856,8849282,2015-07-22T14:45:45Z,"Квартира соответствует фотографиям и описанию; есть всё, что может пригодиться, вплоть до мелочей. Большое спасибо Артёму, — дружелюбный и комфортный в общении хозяин."
1113856,38077734,2015-07-19T19:10:39Z,"Артем дружелюбный и гостеприимный человек, отзывался на каждую нашу просьбу, рассказал о городе, посоветовал места, которые стоит посетить, даже предложил скидку в ресторане неподалеку, которой мы, с удовольствием, воспользовались, квартиру содержит в чистоте, все соответствует описанию, стильный интерьер, все необходимое для проживания есть"
1113856,34794051,2015-07-01T13:47:42Z,"Апартаменты полностью соответствуют картинке. Были вдвоем с женой, нам все очень понравилось, дружелюбный и ответственный хозяин. "
5632821,82084928,2016-10-17T08:03:33Z,"house provided is very clean and the same as expectations. will surely book from this host again, host is very helpful. almost everything is provided within the house, highly recommended."
5632821,41875741,2016-10-02T06:42:42Z,"Все прекрасно, квартира удобно расположена, рядом парк, рестораны и кафе в пешей доступности. Рекомендую "
5632821,45545466,2016-08-26T05:11:33Z,This Airbnb was our cleaneat and most equipped ever. It is like an expensive hotel but better because it is a studio. It is 99% perfect! Fast internet! We highly recommend staying here whenever you are in Volgograd.
5632821,9578669,2016-08-22T01:32:17Z,Замечательная квартира! Есть всё что необходимо! Удобно расположена! Очень вежливые и гостеприимные хозяева Артём и Вадим! Всё чистенько и уютно! Квартира полностью соответствует описаниям и фотографиям!
5632821,51818207,2016-08-16T05:14:00Z,"Квартира отличная, на первом этаже. Хозяин встретил, отдал ключи, подписал договор и уехал. Душевые принадлежности, чай, сахар, кухонная утварь, все есть. Спасибо огромное!!! "
5632821,19668327,2016-07-20T08:12:56Z,"Очень чистая и уютная квартира, нам с женой было комфортно. Хозяин очень хорошо встретил и больше не беспокоил, проживание прошло отлично. Расположение очень удачное, рядом центр города (в пешей доступности). "
5632821,35681198,2016-05-10T01:26:24Z,"Месторасположение квартиры приятно порадовало: рядом парки, главная площадь и жд вокзал. Все в шаговой доступности. Встретил нас администратор, он же показал квартиру, объяснил детали и составил договор. Квартира впечатляет- отличный евроремонт, достаточно просторная и в ней есть абсолютно все- всякие одноразовые мелочи, которые часто забываются ( зубная паста и щетка, набор для бритья, губка для обуви и т.д), вся бытовая посуда, фильмы, закаченные на тв. Особенно приятно удивили роллставни, теплые полы в ванной и накрахмаленные полотенца и халаты.  Обслуживание на высшем уровне! Очень понравилось и обязательно приедем еще) Для комфортного отдыха всем советуем остановить свой выбор на этом хозяине. 


This flat is situated in the center of the city. There are parks, the main square and the railway station near by it. 
The administrator showed us the apartment and explain some small details. The flat is great! There are an excellent renovation. The apartment is rather spacious. The apartment owner provided a lot of small pleasant things such as toothpaste and toothbrush, shaving kit, fresh towel and bathrobes. An excellent service. We advise you to choose this variant! "
5632821,34929352,2016-04-09T23:33:26Z,"Второй раз останавливаюсь в квартире которую предоставляет Артем. Первый раз был на Рабоче - Крестьянской , второй раз на Краснознаменской , обе квартиры вызывают поистине восторг , ощущение домашнего уюта и комфорта. Артем  очень отзывчивый человек . "
5632821,53674394,2016-02-16T20:06:13Z,"Замечательная квартира, одним словом - deluxe!)
Хозяин квартиры - очень отзывчивый человек. Всегда рад был помочь, когда у меня возникали различные вопросы)"
5632821,2694863,2015-12-27T13:44:41Z,"This is a lovely apartment: centrally located, very modern, spacious and clean. It has everything one needs. I would definitely stay here again."
